{
  "id": "shirasagi",
  "references": {
    "alpha": "assets-src/imagegen/heroes/shirasagi/concept/shirasagi-concept-alpha-v1.png",
    "green": "assets-src/imagegen/heroes/shirasagi/concept/shirasagi-concept-green-v1.png"
  },
  "role": "damage",
  "cohort": "precision sniper",
  "modelArchetype": "long-limbed frost archer",
  "proportions": {
    "heightM": 1.85,
    "bodyRatio": "long legs,thin waist,extended silhouette",
    "notes": "Keep shirasagi proportions legible at gameplay distance; preserve the distinctive white bird hood and lens against a neutral rig."
  },
  "silhouetteAnchors": {
    "front": [
      "white bird hood and lens",
      "long mantle over narrow torso",
      "steady bracer arm"
    ],
    "side": [
      "long legs,thin waist,extended silhouette profile",
      "heeled frost boots",
      "condensation lens"
    ]
  },
  "materialPalette": [
    {
      "name": "ice",
      "hex": "#c9e6eb",
      "finish": "hero primary matte"
    },
    {
      "name": "pale blue",
      "hex": "#7aa6ba",
      "finish": "secondary worn surface"
    },
    {
      "name": "silver",
      "hex": "#e8f5fa",
      "finish": "emissive or trim accent"
    }
  ],
  "primitives": {
    "head": [
      "white bird hood and lens"
    ],
    "torso": [
      "long mantle over narrow torso"
    ],
    "limbs": [
      "steady bracer arm",
      "heeled frost boots"
    ],
    "weapons": [
      "precision bow-rifle"
    ],
    "accessories": [
      "condensation lens"
    ]
  },
  "rig": {
    "pivot": "root at ground contact, +Y up, +Z forward, centered on gameplay capsule",
    "sockets": [
      "weapon_primary",
      "hand_off",
      "back_accessory",
      "vfx_origin"
    ],
    "colliders": [
      "capsule matches body width and height",
      "separate accessory hit proxy where silhouette overhangs"
    ]
  },
  "animation": {
    "locomotion": [
      "quiet measured walk",
      "strafe without foot sliding",
      "crouch/stop preserves anchor silhouette"
    ],
    "combat": [
      "charge and release",
      "ability pose keeps weapon socket stable"
    ],
    "deformationBudget": "No more than 4 corrective shape keys; rigid props remain socketed."
  },
  "reconstructionRisks": [
    "The condensation lens overhang can inflate the collider if not separated.",
    "Asymmetric steady bracer arm needs mirrored fallback controls for retargeting."
  ],
  "qualityAcceptance": {
    "targets": [
      "Front and side renders match every listed silhouette anchor at thumbnail size",
      "Palette values remain within authored hex swatches under neutral light",
      "Weapon and accessory sockets stay aligned through locomotion and ability clips"
    ],
    "gates": [
      "alpha/green reference comparison recorded",
      "glTF export reopens with no missing materials"
    ]
  },
  "rollout": {
    "priority": 8,
    "rationale": "shirasagi establishes the precision sniper cohort and exposes its condensation lens anchor early."
  },
  "status": "brief"
}

