{
  "id": "tsubakuro",
  "references": {
    "alpha": "assets-src/imagegen/heroes/tsubakuro/concept/tsubakuro-concept-alpha-v1.png",
    "green": "assets-src/imagegen/heroes/tsubakuro/concept/tsubakuro-concept-green-v1.png"
  },
  "role": "damage",
  "cohort": "mobile skirmisher",
  "modelArchetype": "winged rooftop rogue",
  "proportions": {
    "heightM": 1.8,
    "bodyRatio": "lean torso,high hips,wing span",
    "notes": "Keep tsubakuro proportions legible at gameplay distance; preserve the distinctive beaked hood with swept crest against a neutral rig."
  },
  "silhouetteAnchors": {
    "front": [
      "beaked hood with swept crest",
      "short flight jacket",
      "feathered arm blades"
    ],
    "side": [
      "lean torso,high hips,wing span profile",
      "spring ankle guards",
      "back wing vanes"
    ]
  },
  "materialPalette": [
    {
      "name": "green",
      "hex": "#53b886",
      "finish": "hero primary matte"
    },
    {
      "name": "black",
      "hex": "#1c2b2a",
      "finish": "secondary worn surface"
    },
    {
      "name": "copper",
      "hex": "#c58a55",
      "finish": "emissive or trim accent"
    }
  ],
  "primitives": {
    "head": [
      "beaked hood with swept crest"
    ],
    "torso": [
      "short flight jacket"
    ],
    "limbs": [
      "feathered arm blades",
      "spring ankle guards"
    ],
    "weapons": [
      "twin wing blades"
    ],
    "accessories": [
      "back wing vanes"
    ]
  },
  "rig": {
    "pivot": "root at ground contact, +Y up, +Z forward, centered on gameplay capsule",
    "sockets": [
      "weapon_primary",
      "hand_off",
      "back_accessory",
      "vfx_origin"
    ],
    "colliders": [
      "capsule matches body width and height",
      "separate accessory hit proxy where silhouette overhangs"
    ]
  },
  "animation": {
    "locomotion": [
      "acrobatic run",
      "strafe without foot sliding",
      "crouch/stop preserves anchor silhouette"
    ],
    "combat": [
      "dash and vault",
      "ability pose keeps weapon socket stable"
    ],
    "deformationBudget": "No more than 4 corrective shape keys; rigid props remain socketed."
  },
  "reconstructionRisks": [
    "The back wing vanes overhang can inflate the collider if not separated.",
    "Asymmetric feathered arm blades needs mirrored fallback controls for retargeting."
  ],
  "qualityAcceptance": {
    "targets": [
      "Front and side renders match every listed silhouette anchor at thumbnail size",
      "Palette values remain within authored hex swatches under neutral light",
      "Weapon and accessory sockets stay aligned through locomotion and ability clips"
    ],
    "gates": [
      "alpha/green reference comparison recorded",
      "glTF export reopens with no missing materials"
    ]
  },
  "rollout": {
    "priority": 9,
    "rationale": "tsubakuro establishes the mobile skirmisher cohort and exposes its back wing vanes anchor early."
  },
  "status": "brief"
}

