{
  "id": "baraga",
  "references": {
    "alpha": "assets-src/imagegen/heroes/baraga/concept/concept-alpha-v1.png",
    "green": "assets-src/imagegen/heroes/baraga/concept/concept-green-v1.png"
  },
  "role": "frontline",
  "cohort": "forge bulwark",
  "modelArchetype": "blocky furnace guardian",
  "proportions": {
    "heightM": 2.1,
    "bodyRatio": "square shoulders,low center,thick limbs",
    "notes": "Keep baraga proportions legible at gameplay distance; preserve the distinctive square mask with horn blocks against a neutral rig."
  },
  "silhouetteAnchors": {
    "front": [
      "square mask with horn blocks",
      "rectangular forged cuirass",
      "piston forearms"
    ],
    "side": [
      "square shoulders,low center,thick limbs profile",
      "braced greaves",
      "heat vents"
    ]
  },
  "materialPalette": [
    {
      "name": "rust",
      "hex": "#c96d3d",
      "finish": "hero primary matte"
    },
    {
      "name": "charcoal",
      "hex": "#29252a",
      "finish": "secondary worn surface"
    },
    {
      "name": "brass",
      "hex": "#d19a4a",
      "finish": "emissive or trim accent"
    }
  ],
  "primitives": {
    "head": [
      "square mask with horn blocks"
    ],
    "torso": [
      "rectangular forged cuirass"
    ],
    "limbs": [
      "piston forearms",
      "braced greaves"
    ],
    "weapons": [
      "forged hammer"
    ],
    "accessories": [
      "heat vents"
    ]
  },
  "rig": {
    "pivot": "root at ground contact, +Y up, +Z forward, centered on gameplay capsule",
    "sockets": [
      "weapon_primary",
      "hand_off",
      "back_accessory",
      "vfx_origin"
    ],
    "colliders": [
      "capsule matches body width and height",
      "separate accessory hit proxy where silhouette overhangs"
    ]
  },
  "animation": {
    "locomotion": [
      "armored march",
      "strafe without foot sliding",
      "crouch/stop preserves anchor silhouette"
    ],
    "combat": [
      "hammer swing",
      "ability pose keeps weapon socket stable"
    ],
    "deformationBudget": "No more than 4 corrective shape keys; rigid props remain socketed."
  },
  "reconstructionRisks": [
    "The heat vents overhang can inflate the collider if not separated.",
    "Asymmetric piston forearms needs mirrored fallback controls for retargeting."
  ],
  "qualityAcceptance": {
    "targets": [
      "Front and side renders match every listed silhouette anchor at thumbnail size",
      "Palette values remain within authored hex swatches under neutral light",
      "Weapon and accessory sockets stay aligned through locomotion and ability clips"
    ],
    "gates": [
      "alpha/green reference comparison recorded",
      "glTF export reopens with no missing materials"
    ]
  },
  "rollout": {
    "priority": 2,
    "rationale": "baraga establishes the forge bulwark cohort and exposes its heat vents anchor early."
  },
  "status": "brief"
}

