{
  "id": "shirabe",
  "references": {
    "alpha": "assets-src/imagegen/heroes/shirabe/concept-alpha-v1.png",
    "green": "assets-src/imagegen/heroes/shirabe/concept-green-v1.png"
  },
  "role": "support",
  "cohort": "attack amplifier",
  "modelArchetype": "resonant string musician",
  "proportions": {
    "heightM": 1.74,
    "bodyRatio": "slim vertical frame,open chest,flowing scarf",
    "notes": "Keep shirabe proportions legible at gameplay distance; preserve the distinctive tuning-fork crest against a neutral rig."
  },
  "silhouetteAnchors": {
    "front": [
      "tuning-fork crest",
      "instrument harness torso",
      "string bracer arms"
    ],
    "side": [
      "slim vertical frame,open chest,flowing scarf profile",
      "split coat legs",
      "floating tuning arcs"
    ]
  },
  "materialPalette": [
    {
      "name": "violet",
      "hex": "#a66fc2",
      "finish": "hero primary matte"
    },
    {
      "name": "midnight",
      "hex": "#24203a",
      "finish": "secondary worn surface"
    },
    {
      "name": "silver",
      "hex": "#d5c9ea",
      "finish": "emissive or trim accent"
    }
  ],
  "primitives": {
    "head": [
      "tuning-fork crest"
    ],
    "torso": [
      "instrument harness torso"
    ],
    "limbs": [
      "string bracer arms",
      "split coat legs"
    ],
    "weapons": [
      "resonance lute"
    ],
    "accessories": [
      "floating tuning arcs"
    ]
  },
  "rig": {
    "pivot": "root at ground contact, +Y up, +Z forward, centered on gameplay capsule",
    "sockets": [
      "weapon_primary",
      "hand_off",
      "back_accessory",
      "vfx_origin"
    ],
    "colliders": [
      "capsule matches body width and height",
      "separate accessory hit proxy where silhouette overhangs"
    ]
  },
  "animation": {
    "locomotion": [
      "swaying walk",
      "strafe without foot sliding",
      "crouch/stop preserves anchor silhouette"
    ],
    "combat": [
      "strum and link",
      "ability pose keeps weapon socket stable"
    ],
    "deformationBudget": "No more than 4 corrective shape keys; rigid props remain socketed."
  },
  "reconstructionRisks": [
    "The floating tuning arcs overhang can inflate the collider if not separated.",
    "Asymmetric string bracer arms needs mirrored fallback controls for retargeting."
  ],
  "qualityAcceptance": {
    "targets": [
      "Front and side renders match every listed silhouette anchor at thumbnail size",
      "Palette values remain within authored hex swatches under neutral light",
      "Weapon and accessory sockets stay aligned through locomotion and ability clips"
    ],
    "gates": [
      "alpha/green reference comparison recorded",
      "glTF export reopens with no missing materials"
    ]
  },
  "rollout": {
    "priority": 16,
    "rationale": "shirabe establishes the attack amplifier cohort and exposes its floating tuning arcs anchor early."
  },
  "status": "brief"
}
